{
  "MaxPenetration": 0.95,
  "MinSpreadDegrees": 0.5,
  "BaseArrowRecoveryRate": 0.25,
  "SkilledArrowRecoveryRate": 0.5,
  "BookRangeMult": 1,
  "BookFlightSpeedMult": 1.2,
  "BookSpreadMult": 0.9,
  "BookAttackSpeedMult": 1.02,
  "Arrows": {
    "ammo_arrow_stick": {
      "Key": "ammo_arrow_stick",
      "Name": "削尖的木箭",
      "Description": "一根削尖的木棍，会飞。",
      "Craftable": true,
      "DamageMult": 0.75,
      "PenetrationMult": 0.75,
      "RangeMult": 0.75,
      "CooldownMult": 1,
      "SpreadMult": 1.1
    },
    "ammo_arrow_handmade": {
      "Key": "ammo_arrow_handmade",
      "Name": "自制箭",
      "Description": "木杆、铁头、羽毛尾翎，手工出品。",
      "Craftable": true,
      "DamageMult": 1,
      "PenetrationMult": 1,
      "RangeMult": 1,
      "CooldownMult": 1,
      "SpreadMult": 1
    },
    "ammo_arrow_heavy": {
      "Key": "ammo_arrow_heavy",
      "Name": "重头箭",
      "Description": "什么叫他射了一根长矛过来？",
      "Craftable": true,
      "DamageMult": 1.25,
      "PenetrationMult": 1.75,
      "RangeMult": 0.75,
      "CooldownMult": 1.1,
      "SpreadMult": 1.25
    },
    "ammo_arrow_carbon": {
      "Key": "ammo_arrow_carbon",
      "Name": "碳纤维箭",
      "Description": "碳纤维箭杆，笔直、轻盈，现代高分子材料学的得意之作。",
      "Craftable": false,
      "DamageMult": 1.25,
      "PenetrationMult": 1.25,
      "RangeMult": 1.2,
      "CooldownMult": 0.9,
      "SpreadMult": 0.7
    }
  }
}